bio2242,Biodiversity,Biodiversity,,topleft,Main,,Scenario1,,Impacts on Biodiversity Intactness [Sources],,,,line,,,,"The intactness of biodiversity is impacted by fertilization, biomass production, climate risk and land use change through lowering of the maximum sustainable species population or species carrying capacity.",,,,1950,2100,Time (Year),,,,,,Dmnl,,,,Impact of Fertilizer Consumption on Biodiversity,,line,Fertilizer Consumption,Fertilizer Consumption,,,Impact of Biomass Production on Biodiversity,,line,Biomass Production,Biomass Production,,,Impact of Climate Damage on Biodiversity,,line,Climate Damage,Climate Damage,,,Impact of Land Use Change on Biodiversity,,line,Land Use Changes,Land Use Changes,,,Impact of Fertilizer Consumption on Biodiversity,Ref,line,BAU,bau,,,Impact of Biomass Production on Biodiversity,Ref,line,,bau,,,Impact of Climate Damage on Biodiversity,Ref,line,,bau,,,Impact of Land Use Change on Biodiversity,Ref,line,,bau,,,,,,,,,,,,,,,,,,,,,,,,,,,,,,,,,,,,,,,,,,,,,,,,,,,
bio6123,Biodiversity,Biodiversity,,botleft,Main,,Scenario1,,Lost Value of Ecosystems,,,,line,,,,The lost value of the ecosystem is estimated by measuring changes in land area and assessing the economic worth of that land before and after the disturbance.,,,,1950,2100,Time (Year),,,-600,200,,Billion $,,,,Total Lost Value of Ecosystems Per Billion Dollars,,line,New Scenario,cust,,,Total Lost Value of Ecosystems Per Billion Dollars,Ref,line,BAU,bau,,,,,,,,,,,,,,,,,,,,,,,,,,,,,,,,,,,,,,,,,,,,,,,,,,,,,,,,,,,,,,,,,,,,,,,,,,,,,,,,,,,,,,,,,,,,,
bio2,Biodiversity,Biodiversity,,botright,Main,,Scenario1,,Lost Value of Ecosystems [Land Type],,,,line,,,,"The lost value of the ecosystem is estimated by measuring changes in land area and assessing the economic worth of that land before and after the disturbance. Different type of land is considered - forest, cropland and other land like woodland and grassland.",,,,1950,2100,Time (Year),,,-600,200,,Billion $,,,,Total Change in Forest Ecosystem Value Per Billion Dollars,,line,Forest Land,forestland,,,Total Change in Cropland Ecosystem Value Per Billion Dollars,,line,Crop Land,Land Use,,,Total Change in Other Land Ecosystem Value Per Billion Dollars,,line,Other Land,Other Land,,,Total Change in Forest Ecosystem Value Per Billion Dollars,Ref,line,BAU,bau,,,Total Change in Cropland Ecosystem Value Per Billion Dollars,Ref,line,,bau,,,Total Change in Other Land Ecosystem Value Per Billion Dollars,Ref,line,,bau,,,,,,,,,,,,,,,,,,,,,,,,,,,,,,,,,,,,,,,,,,,,,,,,,,,,,,,,,,,,,,,,,
bio10,Biodiversity,Biodiversity,,,Etc,,Scenario1,,"Intactness of Biodiversity [Regeneration, Extinction]",,,,line,,,,,,,,1950,2100,Time (Year),,,-2,2,,Mean Species Abundance,,,,Species Regeneration Rate,,line,Regeneration Rate,green,,,Negative Species Extinction Rate,,line,Extinction Rate,red,,,Species Regeneration Rate,Ref,line,BAU,bau,,,Negative Species Extinction Rate,Ref,line,,bau,,,,,,,,,,,,,,,,,,,,,,,,,,,,,,,,,,,,,,,,,,,,,,,,,,,,,,,,,,,,,,,,,,,,,,,,,,,,,,,
bio9,Biodiversity,Biodiversity,,,Etc,,Scenario1,,Rate of Agriculture Land Degradation,,,,line,,,,,,,,1950,2100,Time (Year),,,,,,Ha / Year,,,,Agricultral Land Erosion,,line,Land Erosion,blue,,,Agricultural Land Conversion,,line,Land Conversion,brown,,,Agricultral Land Erosion,Ref,line,BAU,bau,,,Agricultural Land Conversion,Ref,line,,bau,,,,,,,,,,,,,,,,,,,,,,,,,,,,,,,,,,,,,,,,,,,,,,,,,,,,,,,,,,,,,,,,,,,,,,,,,,,,,,,
,,,,,,,,,,,,,,,,,,,,,,,,,,,,,,,,,,,,,,,,,,,,,,,,,,,,,,,,,,,,,,,,,,,,,,,,,,,,,,,,,,,,,,,,,,,,,,,,,,,,,,,,,,,,,,,,,,,,,,,,,,,,,,,,,,,,,,,,,
bio5,Biodiversity,Biodiversity,,,Scenario Comparisons,,Scenario2,,(2) Biodiversity Intactness,,,,line,,,,,,,,1950,2100,Time (Year),,,,,,Mean Species Abundance,,,,Mean Species Abundance,,line,Scenario 2,s2,,,Mean Species Abundance,Ref,line,BAU,bau,,,,,,,,,,,,,,,,,,,,,,,,,,,,,,,,,,,,,,,,,,,,,,,,,,,,,,,,,,,,,,,,,,,,,,,,,,,,,,,,,,,,,,,,,,,,,
bio6,Biodiversity,Biodiversity,,,Scenario Comparisons,,Scenario2,,(2) Lost Value of Ecosystems,,,,line,,,,,,,,1950,2100,Time (Year),,,-600,200,,Billion $,,,,Total Lost Value of Ecosystems Per Billion Dollars,,line,Scenario 2,s2,,,Total Lost Value of Ecosystems Per Billion Dollars,Ref,line,BAU,bau,,,,,,,,,,,,,,,,,,,,,,,,,,,,,,,,,,,,,,,,,,,,,,,,,,,,,,,,,,,,,,,,,,,,,,,,,,,,,,,,,,,,,,,,,,,,,
,,,,,,,,,,,,,,,,,,,,,,,,,,,,,,,,,,,,,,,,,,,,,,,,,,,,,,,,,,,,,,,,,,,,,,,,,,,,,,,,,,,,,,,,,,,,,,,,,,,,,,,,,,,,,,,,,,,,,,,,,,,,,,,,,,,,,,,,,
,,,,,,,,,,,,,,,,,,,,,,,,,,,,,,,,,,,,,,,,,,,,,,,,,,,,,,,,,,,,,,,,,,,,,,,,,,,,,,,,,,,,,,,,,,,,,,,,,,,,,,,,,,,,,,,,,,,,,,,,,,,,,,,,,,,,,,,,,
,,,,,,,,,,,,,,,,,,,,,,,,,,,,,,,,,,,,,,,,,,,,,,,,,,,,,,,,,,,,,,,,,,,,,,,,,,,,,,,,,,,,,,,,,,,,,,,,,,,,,,,,,,,,,,,,,,,,,,,,,,,,,,,,,,,,,,,,,
water1,Water,Water,,topleft,Main,,Scenario1,,Total Water Demand,,,,line,,,,"The total water demanded includes the combined demand from agricultural, domestic, and industrial activities.",,,,1950,2100,Time (Year),,,,,,Billion m3 /Year,,,,Total Water Demand Per Billion Cubic Metres,,line,New Scenario,cust,,,Total Water Demand Per Billion Cubic Metres,Ref,line,BAU,bau,,,,,,,,,,,,,,,,,,,,,,,,,,,,,,,,,,,,,,,,,,,,,,,,,,,,,,,,,,,,,,,,,,,,,,,,,,,,,,,,,,,,,,,,,,,,,
water33,Water,Water,,topleft,Main,,Scenario1,,Total Water Demand [Sources],,,,stacked-line,,,,"The total water demanded includes the combined demand from agricultural, domestic, and industrial activities. Agricultural water demand accounts for irrigation, livestock, and food production. Domestic water demand refers to the water required for drinking, cooking, cleaning, and sanitation in households. Industrial water demand includes the water needed for manufacturing, energy production, and other industrial processes.",,,,1950,2100,Time (Year),,,,,,Billion m3 /Year,,,,Agricultural Water Demand Per Billion Cubic Metres,,area,Agricultural,green,,,Domestic Water Demand Per Billion Cubic Metres,,area,Domestic,blue,,,Industrial Water Demand Per Billion Cubic Metres,,area,Industrial,gray,,,,,,,,,,,,,,,,,,,,,,,,,,,,,,,,,,,,,,,,,,,,,,,,,,,,,,,,,,,,,,,,,,,,,,,,,,,,,,,,,,,,,,
water22x,Water,Water,,botleft,Main,,Scenario1,,Agricultural Water Demand,,,,line,,,,The total water required in agriculture comes from two main sources: irrigation and rainfed agriculture.,,,,1950,2100,Time (Year),,,,,,Billion m3 /Year,,,,Agricultural Water Demand Per Billion Cubic Metres,,line,New Scenario,cust,,,Agricultural Water Demand Per Billion Cubic Metres,Ref,line,BAU,bau,,,,,,,,,,,,,,,,,,,,,,,,,,,,,,,,,,,,,,,,,,,,,,,,,,,,,,,,,,,,,,,,,,,,,,,,,,,,,,,,,,,,,,,,,,,,,
water33x,Water,Water,,botright,Main,,Scenario1,,Agricultural Water Demand [Sources],,,,stacked-line,,,,"The total water required in agriculture comes from two main sources: irrigation and rainfed agriculture. Irrigation water is supplied through artificial methods such as canals, sprinklers, and drip systems to supplement rainfall and ensure consistent crop growth, especially in dry regions. Rainfed agriculture relies entirely on natural rainfall for crop production, making it more vulnerable to climate variability and drought.",,,,1950,2100,Time (Year),,,,,,Billion m3 /Year,,,,Irrigated Agricuture Water Demand Per Billion Cubic Metres,,area,Irrigated Agriculture,olive,,,Rainfed Agriculture Water Demand Per Billion Cubic Metres,,area,Rainfed Agriculture,teal,,,,,,,,,,,,,,,,,,,,,,,,,,,,,,,,,,,,,,,,,,,,,,,,,,,,,,,,,,,,,,,,,,,,,,,,,,,,,,,,,,,,,,,,,,,,,
,,,,,,,,,,,,,,,,,,,,,,,,,,,,,,,,,,,,,,,,,,,,,,,,,,,,,,,,,,,,,,,,,,,,,,,,,,,,,,,,,,,,,,,,,,,,,,,,,,,,,,,,,,,,,,,,,,,,,,,,,,,,,,,,,,,,,,,,,
water2,Water,Water,,,Etc,,Scenario1,,Agricultural Water Withdrawal Rate,,,,line,,,,,,,,1950,2100,Time (Year),,,,,,Billion m3 /Year,,,,Agricultural Water Withdrawal Rate Per Billion Cubic Metres,,line,New Scenario,cust,,,Agricultural Water Withdrawal Rate Per Billion Cubic Metres,Ref,line,BAU,bau,,,,,,,,,,,,,,,,,,,,,,,,,,,,,,,,,,,,,,,,,,,,,,,,,,,,,,,,,,,,,,,,,,,,,,,,,,,,,,,,,,,,,,,,,,,,,
water4,Water,Water,,,Etc,,Scenario1,,Used Water Resources, ,,,line,,,,,,,,1950,2100,Time (Year),,,,,,Billion m3,.0f,,,Used Water Resources Per Billion Cubic Metres,,line,New Scenario,cust,,,Used Water Resources Per Billion Cubic Metres,Ref,line,BAU,bau,,,,,,,,,,,,,,,,,,,,,,,,,,,,,,,,,,,,,,,,,,,,,,,,,,,,,,,,,,,,,,,,,,,,,,,,,,,,,,,,,,,,,,,,,,,,,
,,,,,,,,,,,,,,,,,,,,,,,,,,,,,,,,,,,,,,,,,,,,,,,,,,,,,,,,,,,,,,,,,,,,,,,,,,,,,,,,,,,,,,,,,,,,,,,,,,,,,,,,,,,,,,,,,,,,,,,,,,,,,,,,,,,,,,,,,
water1sda,Water,Water,,,Scenario Comparisons,,Scenario2,,(2) Total Water Demand,,,,line,,,,,,,,1950,2100,Time (Year),,,,,,Billion m3 /Year,,,,Total Water Demand Per Billion Cubic Metres,,line,Scenario 2,s2,,,Total Water Demand Per Billion Cubic Metres,Ref,line,BAU,bau,,,,,,,,,,,,,,,,,,,,,,,,,,,,,,,,,,,,,,,,,,,,,,,,,,,,,,,,,,,,,,,,,,,,,,,,,,,,,,,,,,,,,,,,,,,,,
water5,Water,Water,,,Scenario Comparisons,,Scenario2,,(2) Agricultural Water Demand,,,,line,,,,,,,,1950,2100,Time (Year),,,,,,Billion m3 /Year,,,,Agricultural Water Demand Per Billion Cubic Metres,,line,Scenario 2,s2,,,Agricultural Water Demand Per Billion Cubic Metres,Ref,line,BAU,bau,,,,,,,,,,,,,,,,,,,,,,,,,,,,,,,,,,,,,,,,,,,,,,,,,,,,,,,,,,,,,,,,,,,,,,,,,,,,,,,,,,,,,,,,,,,,,
,,,,,,,,,,,,,,,,,,,,,,,,,,,,,,,,,,,,,,,,,,,,,,,,,,,,,,,,,,,,,,,,,,,,,,,,,,,,,,,,,,,,,,,,,,,,,,,,,,,,,,,,,,,,,,,,,,,,,,,,,,,,,,,,,,,,,,,,,
,,,,,,,,,,,,,,,,,,,,,,,,,,,,,,,,,,,,,,,,,,,,,,,,,,,,,,,,,,,,,,,,,,,,,,,,,,,,,,,,,,,,,,,,,,,,,,,,,,,,,,,,,,,,,,,,,,,,,,,,,,,,,,,,,,,,,,,,,
sum1,Summary,Summary,,topleft,Main,,Scenario1,,Climate // CO2 Emissions from AFOLU,,,,line,,,,"AFOLU (Agriculture, Forestry, and Other Land Use) describe the human activities that impact land-based carbon emissions including farming, deforestation, reforestation, and land management.",,,,1950,2100,Time (Year),,,,,,Billion Ton CO2 / Year,,,,Total CO2 Emissions from AFOLU,,line,New Scenario,cust,,,Total CO2 Emissions from AFOLU,Ref,line,BAU,bau,,,,,,,,,,,,,,,,,,,,,,,,,,,,,,,,,,,,,,,,,,,,,,,,,,,,,,,,,,,,,,,,,,,,,,,,,,,,,,,,,,,,,,,,,,,,,
sum2,Summary,Summary,,topleft,Main,,Scenario1,,Fertilizer Use // N and P Balance for Food and Agriculture,,,,line,,,,Nitrogen/Phosphorus balance refers to the net difference between Nitrogen/Phosphorus inflows and outflows. A neutral or slight positive balance is desired.,,,,1950,2100,Time (Year),,,-3.5,3.5,,kg / (Year * ha),,,,Food and Agriculture Nitrogen Balance,,line,Nitrogen,black,,,Food and Agriculture Nitrogen Balance,Ref,line,,bau,,,Food and Agriculture Phosphorous Balance,,line,Phosphorus,purple,,,Food and Agriculture Phosphorous Balance,Ref,line,BAU,bau,,,,,,,,,,,,,,,,,,,,,,,,,,,,,,,,,,,,,,,,,,,,,,,,,,,,,,,,,,,,,,,,,,,,,,,,,,,,,,,
sum3,Summary,Summary,,botleft,Main,,Scenario1,,Biodiversity // Biodiversity Intactness,,,,line,,,,"Measured in the Mean Species Abundance index, which indicates the average population of species relative to undisturbed ecosystems. 1 represents that the ecosystem is undisturbed, 0 represents that the species are completely lost.",,,,1950,2100,Time (Year),,,,,,Mean Species Abundance,,,,Mean Species Abundance,,line,New Scenario,cust,,,Mean Species Abundance,Ref,line,BAU,bau,,,,,,,,,,,,,,,,,,,,,,,,,,,,,,,,,,,,,,,,,,,,,,,,,,,,,,,,,,,,,,,,,,,,,,,,,,,,,,,,,,,,,,,,,,,,,
sum4,Summary,Summary,,botright,Main,,Scenario1,,Water // Agricultural Water Demand,,,,line,,,,The total water required in agriculture comes from two main sources: irrigation and rainfed agriculture.,,,,1950,2100,Time (Year),,,,,,Billion m3 /Year,,,,Agricultural Water Demand Per Billion Cubic Metres,,line,New Scenario,cust,,,Agricultural Water Demand Per Billion Cubic Metres,Ref,line,BAU,bau,,,,,,,,,,,,,,,,,,,,,,,,,,,,,,,,,,,,,,,,,,,,,,,,,,,,,,,,,,,,,,,,,,,,,,,,,,,,,,,,,,,,,,,,,,,,,
,,,,,,,,,,,,,,,,,,,,,,,,,,,,,,,,,,,,,,,,,,,,,,,,,,,,,,,,,,,,,,,,,,,,,,,,,,,,,,,,,,,,,,,,,,,,,,,,,,,,,,,,,,,,,,,,,,,,,,,,,,,,,,,,,,,,,,,,,
sum5,Summary,Summary,,topleft,Scenario Comparisons,,Scenario2,,(2) Climate // CO2 Emissions from AFOLU,,,,line,,,,"AFOLU (Agriculture, Forestry, and Other Land Use) describe the human activities that impact land-based carbon emissions including farming, deforestation, reforestation, and land management.",,,,1950,2100,Time (Year),,,,,,Billion Ton CO2 / Year,,,,Total CO2 Emissions from AFOLU,,line,Scenario 2,s2,,,Total CO2 Emissions from AFOLU,Ref,line,BAU,bau,,,,,,,,,,,,,,,,,,,,,,,,,,,,,,,,,,,,,,,,,,,,,,,,,,,,,,,,,,,,,,,,,,,,,,,,,,,,,,,,,,,,,,,,,,,,,
sum6,Summary,Summary,,topleft,Scenario Comparisons,,Scenario2,,(2) Fertilizer Use // N and P Balance for Food and Agriculture,,,,line,,,,Nitrogen/Phosphorus balance refers to the net difference between Nitrogen/Phosphorus inflows and outflows. A neutral or slight positive balance is desired.,,,,1950,2100,Time (Year),,,-3.5,3.5,,kg / (Year * ha),,,,Food and Agriculture Nitrogen Balance,,line,Nitrogen,orange,,,Food and Agriculture Nitrogen Balance,Ref,line,,bau,,,Food and Agriculture Phosphorous Balance,,line,Phosphorus,brown,,,Food and Agriculture Phosphorous Balance,Ref,line,BAU,bau,,,,,,,,,,,,,,,,,,,,,,,,,,,,,,,,,,,,,,,,,,,,,,,,,,,,,,,,,,,,,,,,,,,,,,,,,,,,,,,
sum7,Summary,Summary,,botleft,Scenario Comparisons,,Scenario2,,(2) Biodiversity // Biodiversity Intactness,,,,line,,,,"Measured in the Mean Species Abundance index, which indicates the average population of species relative to undisturbed ecosystems. 1 represents that the ecosystem is undisturbed, 0 represents that the species are completely lost.",,,,1950,2100,Time (Year),,,,,,Mean Species Abundance,,,,Mean Species Abundance,,line,Scenario 2,s2,,,Mean Species Abundance,Ref,line,BAU,bau,,,,,,,,,,,,,,,,,,,,,,,,,,,,,,,,,,,,,,,,,,,,,,,,,,,,,,,,,,,,,,,,,,,,,,,,,,,,,,,,,,,,,,,,,,,,,
sum8,Summary,Summary,,botright,Scenario Comparisons,,Scenario2,,(2) Water // Agricultural Water Demand,,,,line,,,,The total water required in agriculture comes from two main sources: irrigation and rainfed agriculture.,,,,1950,2100,Time (Year),,,,,,Billion m3 /Year,,,,Agricultural Water Demand Per Billion Cubic Metres,,line,Scenario 2,s2,,,Agricultural Water Demand Per Billion Cubic Metres,Ref,line,BAU,bau,,,,,,,,,,,,,,,,,,,,,,,,,,,,,,,,,,,,,,,,,,,,,,,,,,,,,,,,,,,,,,,,,,,,,,,,,,,,,,,,,,,,,,,,,,,,,